{
  "AH": [
    6.782782628322187e-05,
    1.6957649989938345e-05,
    4.23945246603042e-06,
    1.0601048934773608e-06,
    2.6502663988490355e-07
  ],
  "checkpoints": [
    0,
    64,
    128,
    256,
    512
  ],
  "csv": "/mnt/ironwolf/git/Prometheus_VDM/Derivation/code/outputs/logs/metriplectic/20251013_021248_kg_energy_osc_fit_KG-energy-osc-v1.csv",
  "dt_list": [
    0.2514827607641438,
    0.1257413803820719,
    0.06287069019103594,
    0.03143534509551797,
    0.015717672547758986
  ],
  "e_rev": 2.931682674400804e-16,
  "env_audit": {
    "fft": {
      "plan": "deterministic"
    },
    "numpy": "2.2.6",
    "python": "3.13.5 | packaged by Anaconda, Inc. | (main, Jun 12 2025, 16:09:02) [GCC 11.2.0]",
    "threads": {
      "MKL_NUM_THREADS": null,
      "OMP_NUM_THREADS": null,
      "OPENBLAS_NUM_THREADS": null
    }
  },
  "figure": "/mnt/ironwolf/git/Prometheus_VDM/Derivation/code/outputs/figures/metriplectic/20251013_021247_kg_energy_osc_fit_KG-energy-osc-v1.png",
  "fit": {
    "R2": 0.999999999369685,
    "p": 1.9998849457172685
  },
  "gate": {
    "R2_min": 0.999,
    "p_range": [
      1.95,
      2.05
    ],
    "rel_AH_min_dt": 0.0001
  },
  "grid": {
    "N": 256,
    "dx": 1.0
  },
  "hashes": [
    "dt=0.251482760764;cp=0;seed=10800;h=0d0bc5cb32b95183551b7eb192c7c3ed8ce2c344cfaec516b303a08aac69b8ce:0696b044e8ad9756b6ff194204446787f58d7587153e8f9ac4479aec4b349b52",
    "dt=0.251482760764;cp=64;seed=10800;h=44e85705bde83420f131788f3afa64405e2da5db82666edde2e3d5fa8377396a:afb69d5e6f5244e7067dfb9ddc9d913221d0048b8ff1919b0c588c4b1fef169c",
    "dt=0.251482760764;cp=128;seed=10800;h=f20f17ba8e3413c0f9b6ea49167b4387b2fe21dcf5059a0e88a5421b464ffb14:29c797dc89f9e410b5d59bfb2bc6c5a77b14cfb429d8d935f07cd232f2348aa4",
    "dt=0.251482760764;cp=256;seed=10800;h=c5865ffd15a7896d3e8f5c2fea0e04fb420c6ac75c1e2e96dc6302f7907d5d02:bd56a7dd136b5a6fa2e6ad70b9036a3462d06ccdb74bf4cc0e92879236b80e4d",
    "dt=0.125741380382;cp=0;seed=10800;h=6bbf82d4f9253ba20bf740815483d7062890fd8d2c322a4ebfdb7a50e73293d3:90bd1513572fdd2077b128cd1b169ad9ca993441b86de545653f0a9e8d859c4c",
    "dt=0.125741380382;cp=64;seed=10800;h=fb6e3c3bc184cea46af2522853b098a0e2491b9de5a5d1ec42fe6c850c086f04:7de92494374f936ed802f4dc6ee3d96d2165d384366ffccda665c909f62f92b7",
    "dt=0.125741380382;cp=128;seed=10800;h=ccc0d57254c4b29ddf538059fa07e1efcacd032d1b6df9f8e281f9f25d99c9c5:31a936fc2654849d62c1c087709b70db0ab0d278cf25b7d49bef3fe80de0ac9f",
    "dt=0.125741380382;cp=256;seed=10800;h=dbd9ab61c71dacb71f050e68991d4fc076fe0a5f2ef32d94dbd68af5b87baa6a:964046c0ef27c93eadc5d2edba1c5b76d017e1dee82a53210e8a0cf456481c4f",
    "dt=0.062870690191;cp=0;seed=10800;h=50e639171510c3b1cfc16733c73b0468beb277f001e34d26f153c23c5baf3953:dedf9bd9e06c83e63e7bce588bc5ca6a20b3a6da3310e2a6d55f8238d33b0a1b",
    "dt=0.062870690191;cp=64;seed=10800;h=ed64e699e640c741065e95c95b01e68eaf31595abc292e9113382d205c4e1ad8:083557c3b66910d7f1b4f3bd0322285798c34f8686b33d56cb349ee84738100b",
    "dt=0.062870690191;cp=128;seed=10800;h=c8b9a160f450cb2a94b03fe1bd75eacb4928c163f2dc7561801ff9726e230630:337475416a7eae5e8ac3edb825a2537be6739a8fb44e03d7688f64fbfed3f61e",
    "dt=0.062870690191;cp=256;seed=10800;h=0a1943eb5c6c9efd0ab976460f3e884c9f3a160f3ef7d9893c0f4b4fd034f508:d4ec6f520bbb3a410d947c210d791c8b5b162a3605a384c39421f345bf5127c0",
    "dt=0.0314353450955;cp=0;seed=10800;h=5f80ceeb7a7a73ff44f3e7d4afe494f77076aa3a28bef6f9352e6ed8abebe26b:495f5123497ca5aecbe05bb96c5d0d02cc0977bed55274013a4d02736903b68d",
    "dt=0.0314353450955;cp=64;seed=10800;h=56209ff6976e9496961fe1e2312a84b6b743581cf14fae9c4f01abeaf469e643:0ee344c1daf918c45ec7df126d74fe98078c5f4d74aae7dea1f54e639c6265d7",
    "dt=0.0314353450955;cp=128;seed=10800;h=db57da3eeaa8ff2b240538dec09ca25a3372db47cd5178ec38052f3b81f7cc21:3e84beccb0880a845fe1a8a7322a36c77292bbd197e3754776443d15d7c3093c",
    "dt=0.0314353450955;cp=256;seed=10800;h=38338bdf664043da92b953540bde6c6fa4a5a004be1b5af576b8d31e72be0c89:7e73f54950c7edefee6fa0e14816c6148fb5823ebd59efa321da566bb4e2f63f",
    "dt=0.0157176725478;cp=0;seed=10800;h=52221d568baf25e4740e419919ab92037bcf8f89ae302755ef48c308bc994b69:61be6d88710ba358eaa8df9cce858f050064eec339f9fcef97983bd505fdc93f",
    "dt=0.0157176725478;cp=64;seed=10800;h=ee5944317c359125bd55f82afaa11d9edb15aeae4e81b945c48051ff0850a220:8a372a0f1af53f309e384752dce354c64076c03f795b641ef7ceeeec55e432f8",
    "dt=0.0157176725478;cp=128;seed=10800;h=60162f9df8fbf9c7b7be5eca90bd2fab4ad7b6dd16503ecb9dbf3463ba30e14a:e839b912c8aa32453c8a6d5c6f39ff4ea4b041a08ab8d539d29355fa2bd0c8a1",
    "dt=0.0157176725478;cp=256;seed=10800;h=5f4a544837f6f03505891addb78611fe2285c9cb248171df25d901d213301c02:f542b2696e91c1a6f7d526cf05ee30464037f1ee6100fb30d72026389e703cdc"
  ],
  "params": {
    "bands": [
      [
        1,
        8
      ],
      [
        9,
        24
      ],
      [
        25,
        48
      ]
    ],
    "c": 1.0,
    "m": 0.5,
    "seed_scale": 0.05,
    "seeds_per_band": 2
  },
  "passed": true,
  "rel_AH": [
    0.0034564617895734553,
    0.0008618594323715735,
    0.0002153241751138127,
    5.383441892737383e-05,
    1.3458067984486366e-05
  ],
  "tag": "KG-energy-osc-v1"
}